med_code_id,term,snomed_ct_concept_id,observations
1034891000006113,Adverse reaction to Mycil Athlete's Foot,1034891000006109,
394508013,Cauterisation of lesion of skin NEC,302395004,
274557015,Cauterisation of lesion of skin of head or neck,177327003,
274560010,Cauterised destruction of lesion of skin of head or neck,177327003,
274578017,Chemical peeling of lesion of skin NEC,240996002,
274562019,Chemical peeling of lesion of skin of head or neck,177329000,
394505011,Curettage and cauterisation of lesion of skin NEC,302391008,
274534014,Curettage and cauterisation of lesion of skin head or neck,177312003,
486271000000111,Electrodessication of lesion of skin NEC,450485008,
2674033013,Electrodessication of lesion of skin of the head or neck,426349002,
1776344010,Re-excision of lesion of skin,396401003,
831331000006116,2 week rule referral - skin,831331000006100,
357305010,Abscess of skin area excluding digits of hand or foot,238385004,
1234941012,Accessory skin tags,84449007,
1806391000006119,Acne,11381005,
357834014,Acne agminata,238752009,
70464010,Acne conglobata,42228007,
1218808012,Acne excoriee des jeunes filles,10065003,
40136019,Acne frontalis,23894009,
8786013,Acne fulminans,4659007,
982841000006114,Acne fulminans,982841000006105,
453021000006110,Acne keloid,238746008,
357823011,Acne keloid,238746008,
357818011,Acne keloidalis,238742005,
1711221000006115,Acne keloidalis,1711221000006104,
2376391000000118,Acne management education,926971000000107,
453041000006115,Acne necrotica,45072005,
494096014,Acne necrotica,45072005,
1230762011,Acne neonatorum,49706007,
1786588010,Acne rosacea,398909004,
889291000006117,Acne roscea,398909004,
369523011,Acne scar,247459000,
309123011,Acne urticata,201224007,
40135015,Acne varioliformis,23894009,
399940016,Acne varioliformis NOS,23894009,
146927011,Acne vulgaris,88616000,
453121000006111,"Acne, unspecified",11381005,
1246131000033115,Acne-Aid,1246131000033104,
357680013,Acquired keratosis follicularis,238641006,
455001000006118,Actinic keratosis,201101007,
1208677014,Actinic keratosis,201101007,
357331012,Acute lymphangitis of skin excluding digits of hand or foot,238404003,
461311000006111,Adherent scar (skin),60131003,
1899291000006116,Advice about acne management,1899291000006100,
309291013,Amyloidosis of skin,201337008,
300765017,Anal and rectal skin tags NOS,195469007,
300761014,Anal skin tag,195469007,
360395017,Anal warts,240597001,
484371000006118,Anogenital Warts - First Attack,484371000006102,
484381000006115,Anogenital Warts - Re-registered Cases,484381000006104,
484391000006117,Anogenital Warts - Recurrence,484391000006101,
490621000006118,Araneus naevus,195382003,
11003018,Athlete's foot,6020002,
308902011,Atrophic spots of skin,201070005,
853151000006113,Basal cell carcinoma,853151000006109,
215751000000116,Basal cell carcinoma,254701007,
496786012,Becker's naevus,5387003,
505021000006111,Benign naevus of skin,286903005,
456060017,Benign naevus of sole of foot,312359004,
290516014,Benign neoplasm of other specified skin sites,92384009,
152775015,Benign neoplasm of perianal skin,92288009,
290464019,Benign neoplasm of scalp and skin of neck,189064000,
290465018,Benign neoplasm of scalp or skin of neck NOS,189064000,
290574019,Benign neoplasm of scrotal skin,189138008,
152883016,Benign neoplasm of skin,92384009,
290517017,Benign neoplasm of skin NOS,92384009,
152839013,Benign neoplasm of skin of abdomen,92344000,
290479014,Benign neoplasm of skin of arm,92346003,
290456013,Benign neoplasm of skin of auricle,189057002,
152842019,Benign neoplasm of skin of axilla,92347007,
152843012,Benign neoplasm of skin of back,92348002,
152844018,Benign neoplasm of skin of breast,92349005,
152845017,Benign neoplasm of skin of buttock,92350005,
152846016,Benign neoplasm of skin of cheek,92351009,
152847013,Benign neoplasm of skin of chest,92352002,
152848015,Benign neoplasm of skin of chin,92353007,
406272011,Benign neoplasm of skin of ear and external auditory meatus,271477007,
290457016,Benign neoplasm of skin of external auditory meatus,189058007,
152852015,Benign neoplasm of skin of eyebrow,92357008,
290459018,Benign neoplasm of skin of face NEC,92359006,
290463013,Benign neoplasm of skin of face NOS,297134004,
152857014,Benign neoplasm of skin of foot,92361002,
1235730010,Benign neoplasm of skin of fore-arm,92362009,
152859012,Benign neoplasm of skin of forehead,92363004,
152860019,Benign neoplasm of skin of groin,92364005,
152861015,Benign neoplasm of skin of hand,92365006,
152862010,Benign neoplasm of skin of hip,92366007,
509960016,Benign neoplasm of skin of hip and lower limb,92370004,
290486018,Benign neoplasm of skin of hip or lower limb NOS,92370004,
152863017,Benign neoplasm of skin of knee,92367003,
509959014,Benign neoplasm of skin of leg,92370004,
152865012,Benign neoplasm of skin of lip,92369000,
290485019,Benign neoplasm of skin of lower leg,189084001,
152868014,Benign neoplasm of skin of neck,92371000,
152869018,Benign neoplasm of skin of nose,92372007,
152870017,Benign neoplasm of skin of perineum,92373002,
152873015,Benign neoplasm of skin of shoulder,92376005,
290462015,Benign neoplasm of skin of temple,189062001,
152875010,Benign neoplasm of skin of thigh,92378006,
290466017,"Benign neoplasm of skin of trunk, excluding scrotum",189066003,
290477011,"Benign neoplasm of skin of trunk, excluding scrotum, NOS",189066003,
152879016,Benign neoplasm of skin of umbilicus,92381001,
290481011,Benign neoplasm of skin of upper arm,189080005,
290478018,Benign neoplasm of skin of upper limb and shoulder,189078004,
290484015,Benign neoplasm of skin of upper limb or shoulder NOS,189078004,
509531000006115,Benign neoplasm skin of ear or external auditory meatus NOS,271477007,
274594012,Biopsy of lesion of skin NEC,450623005,
274593018,Biopsy of lesion of skin of head or neck NEC,240977001,
1805101000006118,Bleeding of pigmented skin lesion,1805101000006102,
518971000006118,Blue naevus,254806009,
170673014,Breslow depth staging for melanoma,106243009,
309114013,Bromine acne,201215003,
1727451000006114,C/O skin colour changes,1727451000006105,
1791961000006118,CSCC,1791961000006102,
880561000006117,Ca skin - head/neck,188353002,
880241000006118,Ca skin - lower limb,188127001,
880211000006117,Ca skin - other,573501000000108,
990561000006113,Ca skin - other NOS,573501000000108,
880251000006116,Ca skin - other NOS,540311000000106,
880221000006113,Ca skin - trunk,531581000000101,
880231000006111,Ca skin - upper limb,188119005,
290865013,Carcinoma in situ of other specified sites of skin,92749008,
153282010,Carcinoma in situ of perianal skin,92680006,
290821017,Carcinoma in situ of scalp and skin of neck,189291009,
290824013,Carcinoma in situ of scalp or skin of neck NOS,189291009,
153358015,Carcinoma in situ of skin,92749008,
290866014,Carcinoma in situ of skin NOS,92749008,
290830013,Carcinoma in situ of skin of abdominal wall,189300003,
290808012,Carcinoma in situ of skin of auricle,189279000,
153317010,Carcinoma in situ of skin of axilla,92712002,
153318017,Carcinoma in situ of skin of back,92713007,
153319013,Carcinoma in situ of skin of breast,92714001,
153320019,Carcinoma in situ of skin of buttock,92715000,
153321015,Carcinoma in situ of skin of cheek,92716004,
290827018,Carcinoma in situ of skin of chest wall NOS,189295000,
290809016,Carcinoma in situ of skin of external auricular canal,189280002,
153327016,Carcinoma in situ of skin of eyebrow,92722008,
290806011,Carcinoma in situ of skin of eyelid including canthus,189277003,
153332015,Carcinoma in situ of skin of foot,92726006,
1235762013,Carcinoma in situ of skin of forehead skin,92728007,
153335018,Carcinoma in situ of skin of groin,92729004,
153336017,Carcinoma in situ of skin of hand,92730009,
153337014,Carcinoma in situ of skin of hip,92731008,
290819010,Carcinoma in situ of skin of jaw,189289001,
153338016,Carcinoma in situ of skin of knee,92732001,
536561000006111,Carcinoma in situ of skin of leg,189313009,
153340014,Carcinoma in situ of skin of lip,92734000,
290839014,Carcinoma in situ of skin of lower arm,189309002,
290849012,Carcinoma in situ of skin of lower leg,189317005,
290843013,Carcinoma in situ of skin of lower limb and hip,189313009,
290851011,Carcinoma in situ of skin of lower limb or hip NOS,189313009,
153343011,Carcinoma in situ of skin of neck,92736003,
153344017,Carcinoma in situ of skin of nose,92737007,
536641000006113,Carcinoma in situ of skin of other parts of face,92749008,
536651000006110,Carcinoma in situ of skin of other parts of face NOS,92749008,
153345016,Carcinoma in situ of skin of perineum,92738002,
153348019,Carcinoma in situ of skin of shoulder,92741006,
290818019,Carcinoma in situ of skin of temple,189288009,
153350010,Carcinoma in situ of skin of thigh,92743009,
290835015,Carcinoma in situ of skin of trunk NOS,189295000,
290825014,"Carcinoma in situ of skin of trunk, excluding scrotum",189295000,
290838018,Carcinoma in situ of skin of upper arm,189308005,
290836019,Carcinoma in situ of skin of upper limb and shoulder,189306009,
290841010,Carcinoma in situ of skin of upper limb or shoulder NOS,189306009,
537011000006119,Carcinoma in situ skin of ear and external auricular canal,255144005,
537021000006110,Carcinoma in situ skin of ear/external auricular canal NOS,92724009,
380094018,"Carcinoma of bone, connective tissue, skin and breast",255068000,
75030019,Carneous mole,44979007,
914751000006111,Cautery of wart,914751000006107,
2553955011,Cavernous naevus,416824008,
357316015,Cellulitis of skin area excluding digits of hand or foot,238395006,
2249831000033117,Cetaphil Restoraderm Skin Restoring,2249831000033101,
1488600011,Change in skin lesion,394896005,
459748013,Changing colour of pigmented skin lesion,315254001,
459746012,Changing shape of pigmented skin lesion,315252002,
1805091000006112,Changing size of pigmented skin lesion,1805091000006108,
357604018,Chapping of skin,238594009,
138786017,Chlorine acne,83684005,
138122012,Clark melanoma level 1,83284001,
84190018,Clark melanoma level 2,50542000,
35572018,Clark melanoma level 3,21165006,
3704012,Clark melanoma level 4,1556006,
27148012,Clark melanoma level 5,16034002,
916391000006113,Cleaning skin surrounding stoma,916391000006109,
309117018,Colloid acne,201218001,
1805121000006111,Colour of pigmented skin lesion - finding,1805121000006107,
879281000006112,Common warts,57019003,
1936501000006115,Continence assessment - condition of skin,1936501000006104,
459755010,Crusting of pigmented skin lesion,315258003,
1884191000006113,Crv smr - hi grade dyskaryosis? invasive squamous carcinoma,887521000000104,
383731017,Cryotherapy,257786008,
266641011,Cryotherapy of lesion of canthus,172202002,
273433010,Cryotherapy of lesion of vulva,176607001,
1174741000000111,Cryotherapy to actinic keratosis,445111008,
1233349013,Cryotherapy to ciliary body,71091006,
1216292015,Cryotherapy to haemorrhoid,2908005,
270095011,Cryotherapy to lesion of anus,174340000,
602991000006113,Cryotherapy to lesion of conjunctiva,172384001,
266658018,Cryotherapy to lesion of eyelid,172214005,
273470018,Cryotherapy to lesion of female perineum,176631006,
268173014,Cryotherapy to lesion of lip,173226005,
603041000006111,Cryotherapy to lesion of orbit,172140007,
484249010,Cryotherapy to lesion of penis,29245009,
267149015,Cryotherapy to lesion of retina,172565003,
394510010,Cryotherapy to lesion of skin NEC,302396003,
274561014,Cryotherapy to lesion of skin of head or neck,177328008,
270098013,Cryotherapy to perianal warts,174342008,
1165831000000116,Cryotherapy to verruca pedis,444861005,
483661015,Cryotherapy to wart,27777002,
147531000033110,Cuplex Verruca,147531000033106,
604741000006112,Curettage of lesion of skin,87591000,
274545012,Curettage of lesion of skin NOS,87591000,
604751000006114,Curettage of lesion of skin including head and neck,177312003,
274541015,Curettage of lesion of skin of head or neck NEC,177312003,
604781000006118,Curettage of lesion of skin or subcutaneous tissue,87591000,
22719019,Cystic acne,13277001,
870231000006116,D+C: removal of mole,176832001,
161031000000114,DNA - Did not attend cryotherapy clinic,109351000000102,
607751000006119,Darier's disease - keratosis follicularis,48611009,
395423014,Deep seated dermatophytosis,266152000,
877291000006118,Dermal appendage removal NOS,565191000000104,
614291000006111,Dermal sinus,239151003,
256878013,Dermatoglyphs - skin lines,165185004,
287514011,Dermatophytosis NOS,47382004,
614531000006110,Dermatophytosis including tinea or ringworm,47382004,
1786817018,Dermatophytosis of beard,399329002,
2536410013,Dermatophytosis of foot,6020002,
614571000006113,Dermatophytosis of groin,399029005,
614581000006111,Dermatophytosis of groin and perianal area,399029005,
287499019,Dermatophytosis of groin and perianal area NOS,47382004,
1230667012,Dermatophytosis of hand,48971001,
2536718017,Dermatophytosis of nail,402134005,
1231331018,Dermatophytosis of scalp,5441008,
395418014,Dermatophytosis of scalp or beard,266148000,
287486017,Dermatophytosis of scalp or beard NOS,266148000,
395422016,Dermatophytosis of the body,266151007,
287498010,Dermatophytosis of the perianal area,186991000,
287515012,Dermatophytosis other and unspecified,47382004,
413007013,Dermoid cyst of skin,276729007,
453190018,Deroofing of skin blister,240991007,
411112015,Diathermy of skin lesion NEC,307999008,
621431000006117,Dilation and curettage for removal of mole,176832001,
301981000000119,Direct immunofluorescence of skin,1018491000000103,
1805131000006114,Discharge of pigmented skin lesion - pus,1805131000006105,
69218013,Disseminated superficial actinic porokeratosis,41495000,
419717018,Drainage of boil of skin NEC,281648006,
411013010,Drainage of boil of skin of head or neck,275088000,
419716010,Drainage of lesion of skin NEC,302697001,
394552017,Drainage of lesion of skin of head or neck,265691000,
1222623013,Dystrophic calcification of skin,21323007,
274579013,Electrolysis to lesion of skin NEC,302397007,
274563012,Electrolysis to lesion of skin of head or neck,177330005,
89618011,Endometriosis in scar of skin,53913001,
273847017,Endoscopic cryotherapy to lesion of uterus,176870002,
646771000006117,Epidermal cyst,419893006,
411225019,Epithelioma basal cell,275265005,
2257001000000117,Eron class 1 skin and soft tissue infection,871061000000103,
2257011000000115,Eron class 2 skin and soft tissue infection,871081000000107,
2257021000000114,Eron class 3 skin and soft tissue infection,871101000000101,
2257061000000118,Eron class 4 skin and soft tissue infection,873971000000105,
2250681000000118,Eron class I skin and soft tissue infection,871061000000103,
2250721000000113,Eron class II skin and soft tissue infection,871081000000107,
2250761000000117,Eron class III skin and soft tissue infection,871101000000101,
2257051000000116,Eron class IV skin and soft tissue infection,873971000000105,
1865781000006112,Eron severity classification system skin and soft tissue inf,870951000000109,
91065017,Erythematosquamous dermatosis,54792008,
308484017,Erythematosquamous dermatosis NOS,54792008,
2614001000000116,Excessive skin and subcutaneous tissue,722070009,
598561000000110,Excision biopsy of basal cell carcinoma,428796002,
456784019,Excision biopsy of lesion of skin of head or neck,312967000,
598801000000114,Excision biopsy of rodent ulcer,428796002,
456785018,Excision biopsy of skin lesion,312968005,
651081000006111,Excision malignant skin tumour,301889008,
855531000006114,Excision melanoma,855531000006105,
274463014,Excision of blemish of skin NEC,274442008,
274469013,Excision of blemish of skin of head or neck,177273003,
274459019,Excision of fistula of skin NEC,43304004,
274467010,Excision of fistula of skin of head or neck,177271001,
653351000006119,Excision of lesion of skin NEC,35646002,
274527012,Excision of lesion of skin NOS,35646002,
394498019,Excision of lesion of skin of head or neck NEC,25757008,
274480013,Excision of melanoma,177281002,
274477012,Excision of multiple skin lesions,177278007,
270083011,Excision of perianal skin tag,174332006,
270085016,Excision of perianal wart,174333001,
872001000006117,Excision of skin,675671000000108,
872081000006114,Excision of skin NOS,617641000000102,
274446010,Excision of skin and soft tissue of hand,177259007,
443393018,Excision of skin cyst,301890004,
654651000006113,Excision of skin or subcutaneous tissue,440258006,
299521000000118,Excision of skin tag NOS,309430005,
654661000006110,Excision of skin tag of anus,174332006,
274454012,Excision of sweat gland bearing skin NEC,303235008,
654761000006118,Excision of sweat gland bearing skin of axilla,177263000,
273489018,Excision of sweat gland bearing skin of female perineum,176645000,
654781000006111,Excision of sweat gland bearing skin of groin,177264006,
273290013,Excision of sweat gland bearing skin of male perineum,176514008,
17565013,Excoriated acne,10065003,
275073014,Exploration of skin of head or neck NOS,288082006,
427665015,Exploration of skin or subcutaneous tissue,288082006,
660931000006114,Eyelid skin and periocular area laceration,14997005,
473331000000119,Fast track referral for suspected skin cancer,276281000000104,
667991000006114,Female genital tract - skin fistula,36894006,
668001000006116,Female genital tract - skin fistula NOS,36894006,
889581000006117,Fibrosis of skin NOS,606831000000106,
360302013,Filiform wart,240536007,
1865351000006117,Finding of Eron severity classif skin and soft tissue inf,871041000000104,
101401019,Fistula of skin,61018003,
1721991000006115,Fit for modified JCC or SCC only,1721991000006104,
75031015,Fleshy mole,44979007,
1294531000033111,Flexitol Skin,1294531000033107,
315257012,Focal dermal hypoplasia,205573006,
763381000006114,"Follicular cyst of skin & subcutaneous tissue, unspecif",201294000,
309233014,Follicular cysts of skin and subcutaneous tissue,201294000,
456402016,Four layer compression bandaging for skin ulcer,312648001,
795161000006117,Frozen section microsc contr excision lesion skin head/neck,265650002,
795171000006112,Frozen section microscopic control excision skin lesion NEC,302388008,
797031000006118,Fungal infection of skin,14560005,
1577261000006110,G4 [218] Unfit exposure skin irritants/sensitizers (to be spec),1577261000006106,
395367010,Genital warts,266113007,
100229013,Gonococcal keratosis,60335002,
2068331000033116,Great Bear Gb Soft Skin,2068331000033100,
406277017,Haemangioma of skin and subcutaneous tissue,271481007,
405394012,Haematoma with intact skin,105618004,
1223204015,Hand warts,240534005,
187041000000111,High molecular weight kininogen level,1019311000000106,
1998881000006119,High risk basal cell carcinoma,1998881000006103,
333831000033114,Hollister Skin Barrier,333831000033105,
1776209011,Hyperkeratosis,396228006,
357656014,Hyperkeratosis NOS,396228006,
730201000006111,"Hypertrophic disorder of skin, unspecified",24782002,
420185019,Incision biopsy of skin,282014007,
783081000006114,Incision of boil of skin NEC,281648006,
411014016,Incision of boil of skin of head or neck,275089008,
394554016,Incision of lesion of skin NEC,271487006,
394553010,Incision of lesion of skin of head or neck,265692007,
69130014,Incision of skin,41447009,
274946019,Incision of skin NEC,41447009,
872551000006112,Incision of skin NOS,550391000000104,
274943010,Incision of skin of head or neck,177593005,
82790012,Infantile acne,49706007,
5466011,Infected skin ulcer,2622007,
1954811000006112,Infectious disease skin (secondary group),1954811000006108,
1160721000000115,Inflammation of skin,703938007,
486051000000112,Infrared photocoagulation of lesion of skin NEC,64879003,
486031000000117,Infrared photocoagulation of lesion of skin of head or neck,282261000000102,
773151000006112,Insertion of clip into skin/subcutaneous tissue - other site,391906003,
773161000006114,Insertion of clip into skin/subcutaneous tissue head or neck,265681006,
1150421000000118,Internal practice referral for cryotherapy,516611000000106,
309116010,Iodine acne,201217006,
459747015,Irregular outline of pigmented skin lesion,315253007,
459752013,Itching of pigmented skin lesion,315256004,
1140171000000112,Itching of skin lesion,445329008,
173944012,Kaposi's sarcoma of skin,109386008,
379262019,Keratosis,254666005,
754501000006119,Keratosis - middle ear,87688009,
754511000006116,Keratosis follicularis et parafollicular in cutem penetrans,34042008,
498416013,Keratosis obturans,59370009,
754531000006110,Keratosis palmaris,400166009,
754541000006117,Keratosis palmaris et plantaris,400123002,
9596010,Keratosis pilaris,5132005,
1011631000033118,Kinerase Intensive Skin,1011631000033102,
1720841000006114,LS:Unfit exp skin irrit/sensit-type will be spec in Med Docs,1720841000006105,
274550018,Laser destruction of lesion of skin NEC,302394000,
274549018,Laser destruction of lesion of skin of head or neck,177320001,
872111000006115,Laser therapy - skin lesion,566591000000102,
402976019,Late effect of skin and subcutaneous tissue injury,269187004,
402978018,Late effect of skin and subcutaneous tissue injury NOS,269187004,
750051000006119,Late effects of skin injury,269187004,
308948019,Leukokeratosis NEC,80659006,
147588019,Leukokeratosis nicotina palati,89013002,
1787682012,Lichenoid keratosis,403198004,
394496015,Ligation of lesion of skin NEC,302387003,
274468017,Ligation of lesion of skin of head or neck,177272008,
481467018,Ligation of skin tag,22914004,
872051000006118,Ligation of wart,682281000000108,
1721981000006118,Limitation status: Fit for modified JCC or SCC only,1721981000006102,
290372016,Lipoma of skin and subcutaneous tissue (excluding face),188990009,
290392011,Lipoma of skin and subcutaneous tissue (excluding face) NOS,188990009,
154139014,Lipoma of skin and subcutaneous tissue of face,93159009,
290371011,Lipoma of skin and subcutaneous tissue of face NOS,93159009,
737941000006115,Local infection of skin or subcutaneous tissue OS,430348006,
399908015,Local infection skin/subcut tissue NOS,19824006,
878801000006113,Local skin ultraviolet therapy,363695005,
1780421011,Lower leg skin pigmentation,401227003,
309280018,Macerated perianal skin,201328008,
729331000006116,"Malig neop of bone, connective tissue, skin and breast",271467005,
729341000006114,"Malig neop of bone, connective tissue, skin and breast NOS",271467005,
729351000006111,"Malig neop of bone, connective tissue, skin and breast OS",271467005,
729611000006115,Malig neop skin of ear and external auricular canal NOS,126488004,
289052011,Malignant melanoma of ankle,188073001,
289012014,Malignant melanoma of auricle (ear),188033007,
289028016,Malignant melanoma of axilla,188049009,
454085011,Malignant melanoma of back,310498001,
289029012,Malignant melanoma of breast,188050009,
289030019,Malignant melanoma of buttock,188051008,
457109011,Malignant melanoma of chest wall,313248004,
289017015,Malignant melanoma of chin,188038003,
289011019,Malignant melanoma of ear and external auricular canal,188032002,
289014010,Malignant melanoma of ear and external auricular canal NOS,188032002,
289013016,Malignant melanoma of external auditory meatus,188034001,
1235785014,Malignant melanoma of external surface of cheek,93217003,
1235798017,Malignant melanoma of external surface of nose,93643005,
409844012,Malignant melanoma of eye,274087000,
1235786010,Malignant melanoma of eyebrow,93223008,
728201000006110,Malignant melanoma of eyelid including canthus,231834005,
289022015,Malignant melanoma of face NOS,93225001,
289043019,Malignant melanoma of finger,188064009,
289054012,Malignant melanoma of foot,188075008,
289041017,Malignant melanoma of fore-arm,188062008,
289019017,Malignant melanoma of forehead,188040008,
289056014,Malignant melanoma of great toe,188077000,
289031015,Malignant melanoma of groin,188052001,
289042012,Malignant melanoma of hand,188063003,
289053018,Malignant melanoma of heel,188074007,
289047018,Malignant melanoma of hip,188068007,
1697891000006116,Malignant melanoma of iris,1697891000006100,
289049015,Malignant melanoma of knee,188070003,
289009011,Malignant melanoma of lip,188030005,
289051016,Malignant melanoma of lower leg,188072006,
289046010,Malignant melanoma of lower limb and hip,188067002,
289057017,Malignant melanoma of lower limb or hip NOS,188067002,
289025018,Malignant melanoma of neck,188046002,
289015011,Malignant melanoma of other and unspecified parts of face,269578002,
289060012,Malignant melanoma of other specified skin site,93655004,
154231019,Malignant melanoma of perianal skin,93209006,
289033017,Malignant melanoma of perineum,188054000,
289050015,Malignant melanoma of popliteal fossa area,188071004,
289024019,Malignant melanoma of scalp,188045003,
289023013,Malignant melanoma of scalp and neck,188044004,
289026017,Malignant melanoma of scalp and neck NOS,188044004,
289039018,Malignant melanoma of shoulder,188060000,
155060012,Malignant melanoma of skin,93655004,
289063014,Malignant melanoma of skin NOS,93655004,
289021010,Malignant melanoma of temple,188042000,
1694771000006118,Malignant melanoma of the cilary body,1694771000006102,
289048011,Malignant melanoma of thigh,188069004,
289044013,Malignant melanoma of thumb,188065005,
289055013,Malignant melanoma of toe,188076009,
289027014,Malignant melanoma of trunk (excluding scrotum),93651008,
289037016,"Malignant melanoma of trunk, excluding scrotum, NOS",269579005,
289034011,Malignant melanoma of umbilicus,188055004,
289040016,Malignant melanoma of upper arm,188061001,
727731000006113,Malignant melanoma of upper limb and shoulder,269580008,
289045014,Malignant melanoma of upper limb or shoulder NOS,269580008,
2438511000000112,Malignant melanoma stage IA,956331000000107,
2438551000000111,Malignant melanoma stage IB,956351000000100,
2438591000000115,Malignant melanoma stage IIA,956371000000109,
2438631000000115,Malignant melanoma stage IIB,956391000000108,
2438671000000118,Malignant melanoma stage IIC,956411000000108,
2438711000000117,Malignant melanoma stage IIIA,956431000000100,
2438751000000118,Malignant melanoma stage IIIB,956451000000107,
